{
  "schema_version": 2,
  "receipt_kind": "core-reset-evidence-path-performance",
  "generated_at": "2026-07-24T20:22:51.621Z",
  "share_safe": true,
  "issue": 596,
  "benchmark_passed": true,
  "eligible_for_acceptance": true,
  "command": "node tools/eval/core-reset/evidence-path-performance.mjs --contract tools/eval/core-reset/contracts/evidence-path-performance-v2.json --receipt docs/core-reset/evidence/evidence-path-performance.json",
  "contract": {
    "path": "tools/eval/core-reset/contracts/evidence-path-performance-v2.json",
    "fixture_id": "evidence-path-performance-v2",
    "sha256": "4ddba368f5ef17dc059bd8d41c0549e38d6a5ded42e9448ae31aefd0e35506e4"
  },
  "evaluator": {
    "path": "tools/eval/core-reset/evidence-path-performance.mjs",
    "sha256": "6029ab84baa42eeed7abd7df98a8d570f001ddbc349c7a2aee1a28f3ec96893f",
    "schema_path": "tools/eval/core-reset/schemas/evidence-path-performance-receipt.schema.json",
    "schema_sha256": "6c178889c9e2a7b27318145ac49645e3fdb6ea1a907990fff7215d2c32225ce6"
  },
  "subject": {
    "head_commit": "29aba7ebffe14d6a70bde78df1490bf4cded64a4",
    "head_tree_oid": "277649ed917fc134e9808a995ce8c84f22258acb",
    "worktree_dirty": false,
    "build_source": "detached_standalone_exact_head_clone",
    "install_command": "node <resolved-npm-cli> ci --offline --ignore-scripts --no-audit --no-fund --userconfig=<isolated-empty-user-config> --globalconfig=<isolated-empty-global-config>",
    "clean_command": "node --eval 'import { rmSync } from \"node:fs\"; rmSync(\"dist\", { recursive: true, force: true })'",
    "build_command": "node node_modules/typescript/bin/tsc -p tsconfig.build.json",
    "build_completed_before_graph_load": true,
    "source_files": 73,
    "source_tree_sha256": "3635ee3c300aa512576323e413c01172ce6796f3bb3b0f0d75d9d037a670ed22",
    "build_control_files": [
      "package.json",
      "package-lock.json",
      "tsconfig.json",
      "tsconfig.build.json"
    ],
    "build_controls_sha256": "8b8acada478f5153ac0281eda300c7b52cf96fe2bc24546c110e96da08d47ebb",
    "dist_sha256": "d8e2e9308d77796c75d898fe3eedbbb6ff7e8f25350e9967b9738a7c7b6398d4"
  },
  "environment": {
    "node": "v22.9.0",
    "platform": "darwin",
    "release": "25.3.0",
    "arch": "arm64",
    "cpu": "Apple M3 Max",
    "memory_bytes": 51539607552,
    "reference": {
      "node": "v22.9.0",
      "platform": "darwin",
      "release": "25.3.0",
      "arch": "arm64",
      "cpu": "Apple M3 Max",
      "memory_bytes": 51539607552
    },
    "reference_match": true
  },
  "fixture": {
    "algorithm": "component-ring-structural-imports-v3",
    "seed": "sha256-counter-v3:evidence-path-performance-v2",
    "component_count": 150,
    "nodes_per_component": 100,
    "node_count": 15000,
    "edge_count": 30000,
    "authenticated_source_files": 15000,
    "structural_file_nodes": 15000,
    "ranged_file_nodes": 0,
    "file_node_snippets": 0,
    "graph_serialization": "RFC 8785 JSON Canonicalization Scheme",
    "graph_sha256": "b511798c6b15a81bbf9c34c8116ad84b2e9eb1207caa5d6a115a22e9e0f04dc0",
    "graph_root_normalization": "<fixture-root>",
    "source_manifest_sha256": "cfd247261decae2cdef5bfbf36ec97bd2610cc58201532cee7081e6e4b9eacc2",
    "source_manifest_encoding": "sorted path NUL sha256 NUL byte-length LF"
  },
  "protocol": {
    "graph_loaded_before_timer": true,
    "graph_serialized_before_timer": true,
    "graph_deserialized_before_timer": true,
    "query_index_inspected_before_timer": true,
    "validation_outside_timed_window": true,
    "query_schedule": "queries[index modulo 5]",
    "clock": "node:perf_hooks performance.now",
    "percentile": "nearest-rank p95 over the 20 elapsed_ms samples",
    "process_model": "one Node process; one parsed graph inspected into one ready query index reused by all invocations"
  },
  "correctness": {
    "preflight": [
      {
        "query_index": 0,
        "outcome": "evidence",
        "nodes": 5,
        "relationships": 4,
        "boundaries": 0,
        "selected_files": 5,
        "snippets": 0,
        "closure_passes": 1,
        "serialized_tokens": 1019,
        "passed": true
      },
      {
        "query_index": 1,
        "outcome": "evidence",
        "nodes": 3,
        "relationships": 2,
        "boundaries": 0,
        "selected_files": 3,
        "snippets": 0,
        "closure_passes": 1,
        "serialized_tokens": 593,
        "passed": true
      },
      {
        "query_index": 2,
        "outcome": "evidence",
        "nodes": 2,
        "relationships": 1,
        "boundaries": 0,
        "selected_files": 2,
        "snippets": 0,
        "closure_passes": 1,
        "serialized_tokens": 385,
        "passed": true
      },
      {
        "query_index": 3,
        "outcome": "evidence",
        "nodes": 2,
        "relationships": 1,
        "boundaries": 0,
        "selected_files": 2,
        "snippets": 0,
        "closure_passes": 1,
        "serialized_tokens": 382,
        "passed": true
      },
      {
        "query_index": 4,
        "outcome": "missing",
        "nodes": 0,
        "relationships": 0,
        "boundaries": 1,
        "selected_files": 0,
        "snippets": 0,
        "closure_passes": 0,
        "serialized_tokens": 64,
        "passed": true
      }
    ],
    "warmups": [
      {
        "invocation": 0,
        "query_index": 0,
        "outcome": "evidence",
        "nodes": 5,
        "relationships": 4,
        "boundaries": 0,
        "selected_files": 5,
        "snippets": 0,
        "closure_passes": 1,
        "serialized_tokens": 1019,
        "passed": true
      },
      {
        "invocation": 1,
        "query_index": 1,
        "outcome": "evidence",
        "nodes": 3,
        "relationships": 2,
        "boundaries": 0,
        "selected_files": 3,
        "snippets": 0,
        "closure_passes": 1,
        "serialized_tokens": 593,
        "passed": true
      },
      {
        "invocation": 2,
        "query_index": 2,
        "outcome": "evidence",
        "nodes": 2,
        "relationships": 1,
        "boundaries": 0,
        "selected_files": 2,
        "snippets": 0,
        "closure_passes": 1,
        "serialized_tokens": 385,
        "passed": true
      }
    ]
  },
  "measurements": {
    "samples": [
      {
        "invocation": 0,
        "elapsed_ms": 239.189,
        "query_index": 0,
        "outcome": "evidence",
        "nodes": 5,
        "relationships": 4,
        "boundaries": 0,
        "selected_files": 5,
        "snippets": 0,
        "closure_passes": 1,
        "serialized_tokens": 1019,
        "passed": true
      },
      {
        "invocation": 1,
        "elapsed_ms": 254.087,
        "query_index": 1,
        "outcome": "evidence",
        "nodes": 3,
        "relationships": 2,
        "boundaries": 0,
        "selected_files": 3,
        "snippets": 0,
        "closure_passes": 1,
        "serialized_tokens": 593,
        "passed": true
      },
      {
        "invocation": 2,
        "elapsed_ms": 241.624,
        "query_index": 2,
        "outcome": "evidence",
        "nodes": 2,
        "relationships": 1,
        "boundaries": 0,
        "selected_files": 2,
        "snippets": 0,
        "closure_passes": 1,
        "serialized_tokens": 385,
        "passed": true
      },
      {
        "invocation": 3,
        "elapsed_ms": 248.574,
        "query_index": 3,
        "outcome": "evidence",
        "nodes": 2,
        "relationships": 1,
        "boundaries": 0,
        "selected_files": 2,
        "snippets": 0,
        "closure_passes": 1,
        "serialized_tokens": 382,
        "passed": true
      },
      {
        "invocation": 4,
        "elapsed_ms": 265.765,
        "query_index": 4,
        "outcome": "missing",
        "nodes": 0,
        "relationships": 0,
        "boundaries": 1,
        "selected_files": 0,
        "snippets": 0,
        "closure_passes": 0,
        "serialized_tokens": 64,
        "passed": true
      },
      {
        "invocation": 5,
        "elapsed_ms": 282.848,
        "query_index": 0,
        "outcome": "evidence",
        "nodes": 5,
        "relationships": 4,
        "boundaries": 0,
        "selected_files": 5,
        "snippets": 0,
        "closure_passes": 1,
        "serialized_tokens": 1019,
        "passed": true
      },
      {
        "invocation": 6,
        "elapsed_ms": 247.508,
        "query_index": 1,
        "outcome": "evidence",
        "nodes": 3,
        "relationships": 2,
        "boundaries": 0,
        "selected_files": 3,
        "snippets": 0,
        "closure_passes": 1,
        "serialized_tokens": 593,
        "passed": true
      },
      {
        "invocation": 7,
        "elapsed_ms": 241.37,
        "query_index": 2,
        "outcome": "evidence",
        "nodes": 2,
        "relationships": 1,
        "boundaries": 0,
        "selected_files": 2,
        "snippets": 0,
        "closure_passes": 1,
        "serialized_tokens": 385,
        "passed": true
      },
      {
        "invocation": 8,
        "elapsed_ms": 226.083,
        "query_index": 3,
        "outcome": "evidence",
        "nodes": 2,
        "relationships": 1,
        "boundaries": 0,
        "selected_files": 2,
        "snippets": 0,
        "closure_passes": 1,
        "serialized_tokens": 382,
        "passed": true
      },
      {
        "invocation": 9,
        "elapsed_ms": 224.748,
        "query_index": 4,
        "outcome": "missing",
        "nodes": 0,
        "relationships": 0,
        "boundaries": 1,
        "selected_files": 0,
        "snippets": 0,
        "closure_passes": 0,
        "serialized_tokens": 64,
        "passed": true
      },
      {
        "invocation": 10,
        "elapsed_ms": 244.01,
        "query_index": 0,
        "outcome": "evidence",
        "nodes": 5,
        "relationships": 4,
        "boundaries": 0,
        "selected_files": 5,
        "snippets": 0,
        "closure_passes": 1,